{
  "id": "video_216",
  "title": "Why Social Validation Matters",
  "topic": "Why Social Validation Matters",
  "template": "explainer",
  "fps": 30,
  "width": 1080,
  "height": 1920,
  "segmentCount": 12,
  "segmentSeconds": 10,
  "category": "INFORMATION SYSTEMS",
  "accentColor": "#f472b6",
  "scenes": [
    {
      "segmentId": "segment_01",
      "label": "Topic frame",
      "narrationText": "Why Social Validation Matters looks simple on the surface, but it is really a system of incentives, rules, and feedback loops.",
      "text": "Why Social Validation Matters",
      "subtext": "A systems explainer in 2 minutes.",
      "duration": 300,
      "visual": "crowd",
      "action": "slow_zoom_in",
      "category": "INFORMATION SYSTEMS",
      "accentColor": "#f472b6",
      "palette": {
        "background": "#1a0524",
        "secondary": "#3b0764"
      },
      "assetTags": [
        "CharacterHappy",
        "CharacterSad",
        "CharacterGeek"
      ],
      "visualDirection": "Open on people and motion to make the topic feel immediate and human.",
      "backgroundMode": "gradient",
      "motion": "pan",
      "overlays": [
        "grain",
        "vignette"
      ],
      "mood": "neutral",
      "crowdCount": 10
    },
    {
      "segmentId": "segment_02",
      "label": "Hook",
      "narrationText": "This matters because why social validation matters changes what people can afford, access, or influence in everyday life.",
      "text": "Why It Matters",
      "subtext": "The critical vulnerabilities hidden within Why Social Validation Matters.",
      "duration": 300,
      "visual": "icons",
      "action": "pan_right",
      "category": "INFORMATION SYSTEMS",
      "accentColor": "#f472b6",
      "palette": {
        "background": "#1a0524",
        "secondary": "#3b0764"
      },
      "assetTags": [
        "media",
        "cloud",
        "ai",
        "PropDeclarativeRobot",
        "PropServer",
        "PropDeclarativeSaturn"
      ],
      "visualDirection": "Use a dense icon field that quickly frames the pressure point or conflict.",
      "backgroundMode": "gradient",
      "motion": "pan",
      "overlays": [
        "grain",
        "vignette"
      ],
      "mood": "stressed",
      "weather": "rain",
      "icons": [
        "media",
        "cloud",
        "ai",
        "PropDeclarativeRobot",
        "PropServer",
        "PropDeclarativeSaturn"
      ]
    },
    {
      "segmentId": "segment_03",
      "label": "System boundary",
      "narrationText": "To understand it, start by mapping the main actors, the rules they follow, and the limits of the system.",
      "text": "System Boundary",
      "subtext": "Mapping the outer limits of the network.",
      "duration": 300,
      "visual": "network",
      "action": "static_focus",
      "category": "INFORMATION SYSTEMS",
      "accentColor": "#f472b6",
      "palette": {
        "background": "#1a0524",
        "secondary": "#3b0764"
      },
      "assetTags": [
        "media",
        "cloud",
        "ai",
        "network",
        "arrow"
      ],
      "visualDirection": "Show the system as connected nodes so the audience sees where the edges are.",
      "backgroundMode": "mesh",
      "motion": "pan",
      "overlays": [
        "grain",
        "vignette",
        "scanlines"
      ],
      "mood": "thinking",
      "networkNodes": [
        "State",
        "Market",
        "Labor",
        "Capital",
        "Public"
      ]
    },
    {
      "segmentId": "segment_04",
      "label": "Cause layer 1",
      "narrationText": "The first layer is the core driver that keeps why social validation matters moving even when the outcomes look unfair or inefficient.",
      "text": "Root Cause",
      "subtext": "The primary engine driving Why Social Validation Matters.",
      "duration": 300,
      "visual": "math_equation",
      "action": "slow_zoom_in",
      "category": "INFORMATION SYSTEMS",
      "accentColor": "#f472b6",
      "palette": {
        "background": "#1a0524",
        "secondary": "#3b0764"
      },
      "assetTags": [
        "chart",
        "arrow",
        "gear",
        "media",
        "cloud"
      ],
      "visualDirection": "Present the first causal layer as a simple abstract mechanism or formula.",
      "backgroundMode": "mesh",
      "motion": "pan",
      "overlays": [
        "grain",
        "vignette"
      ],
      "mood": "neutral"
    },
    {
      "segmentId": "segment_05",
      "label": "Cause layer 2",
      "narrationText": "Then that driver flows through institutions, prices, behavior, and public expectations.",
      "text": "Mechanism",
      "subtext": "How these mechanisms propagate through the network.",
      "duration": 300,
      "visual": "flow",
      "action": "pan_left",
      "category": "INFORMATION SYSTEMS",
      "accentColor": "#f472b6",
      "palette": {
        "background": "#1a0524",
        "secondary": "#3b0764"
      },
      "assetTags": [
        "arrow",
        "loop",
        "media",
        "cloud"
      ],
      "visualDirection": "Turn the mechanism into directional movement so cause and effect read instantly.",
      "backgroundMode": "gradient",
      "motion": "pan",
      "overlays": [
        "grain",
        "vignette"
      ],
      "mood": "neutral",
      "flowLabels": [
        "Trigger",
        "Mechanism",
        "Outcome"
      ]
    },
    {
      "segmentId": "segment_06",
      "label": "Cause layer 3",
      "narrationText": "Over time, feedback loops reinforce the pattern and make the system harder to change.",
      "text": "Feedback Loops",
      "subtext": "The mathematical convergence of these variables.",
      "duration": 300,
      "visual": "lattice",
      "action": "dramatic_pull_back",
      "category": "INFORMATION SYSTEMS",
      "accentColor": "#f472b6",
      "palette": {
        "background": "#1a0524",
        "secondary": "#3b0764"
      },
      "assetTags": [
        "network",
        "gear",
        "algorithm",
        "media",
        "cloud"
      ],
      "visualDirection": "Reveal the deeper feedback structure with denser motion and higher visual complexity.",
      "backgroundMode": "mesh",
      "motion": "drift",
      "overlays": [
        "grain",
        "vignette",
        "scanlines"
      ],
      "mood": "stressed",
      "weather": "rain"
    },
    {
      "segmentId": "segment_07",
      "label": "Data lens",
      "narrationText": "The data lens helps separate intuition from measurement and shows which pressures are actually growing.",
      "text": "Data Lens",
      "subtext": "What the raw metrics reveal about Why Social Validation Matters.",
      "duration": 300,
      "visual": "neural_core",
      "action": "slow_pan_up",
      "category": "INFORMATION SYSTEMS",
      "accentColor": "#f472b6",
      "palette": {
        "background": "#1a0524",
        "secondary": "#3b0764"
      },
      "assetTags": [
        "ai",
        "network",
        "cloud",
        "media",
        "cloud"
      ],
      "visualDirection": "Shift to a data-centric visual that feels analytical and system-wide.",
      "backgroundMode": "mesh",
      "motion": "drift",
      "overlays": [
        "grain",
        "vignette",
        "scanlines"
      ],
      "mood": "thinking"
    },
    {
      "segmentId": "segment_08",
      "label": "Real world scene",
      "narrationText": "What looks abstract in theory appears in the real world as daily constraints, tradeoffs, and visible pressure points.",
      "text": "Real World",
      "subtext": "How this abstract model plays out on the ground.",
      "duration": 300,
      "visual": "city",
      "action": "pan_right",
      "category": "INFORMATION SYSTEMS",
      "accentColor": "#f472b6",
      "palette": {
        "background": "#1a0524",
        "secondary": "#3b0764"
      },
      "assetTags": [
        "home",
        "transport",
        "factory"
      ],
      "visualDirection": "Bring the abstract explanation back to a concrete everyday environment.",
      "backgroundMode": "gradient",
      "motion": "pan",
      "overlays": [
        "grain",
        "vignette"
      ],
      "mood": "neutral"
    },
    {
      "segmentId": "segment_09",
      "label": "Ecology/externalities",
      "narrationText": "Every system pushes some costs outward, and those hidden externalities are often what people notice last.",
      "text": "Hidden Costs",
      "subtext": "Tracing the unintended environmental consequences.",
      "duration": 300,
      "visual": "animals",
      "action": "slow_zoom_in",
      "category": "INFORMATION SYSTEMS",
      "accentColor": "#f472b6",
      "palette": {
        "background": "#1a0524",
        "secondary": "#3b0764"
      },
      "assetTags": [
        "bird",
        "fish",
        "bee"
      ],
      "visualDirection": "Show hidden side effects with ecological or externality imagery.",
      "backgroundMode": "gradient",
      "motion": "pan",
      "overlays": [
        "grain",
        "vignette"
      ],
      "mood": "neutral",
      "animals": [
        "bird",
        "fish",
        "bee"
      ]
    },
    {
      "segmentId": "segment_10",
      "label": "Macro trend",
      "narrationText": "At a larger scale, the same forces shape long-term trends across regions, industries, and institutions.",
      "text": "Macro Trend",
      "subtext": "The inevitable mathematical conclusion on a macro level.",
      "duration": 300,
      "visual": "earth",
      "action": "slow_pan_down",
      "category": "INFORMATION SYSTEMS",
      "accentColor": "#f472b6",
      "palette": {
        "background": "#1a0524",
        "secondary": "#3b0764"
      },
      "assetTags": [
        "globe",
        "cloud",
        "wave",
        "media",
        "cloud"
      ],
      "visualDirection": "Zoom outward and frame the topic as part of a wider long-range pattern.",
      "backgroundMode": "terrain",